text,subreddit,post_or_comment,expected_political_leaning,score
psa visiting sub first time dont break reddits tos post comment call violence physical harm,Democrats,comment,lib,1
dont forget laughed cheered bidens campaign bus almost got ran freeway texas back 2020 many people couldve died bus rolled culmination 9 plus year trump rhetoric started assaulting protestors campaign rally 2016 january 6thnow like harkonnen told leto dune he sitting chair naked paralyzed think happens next dont fall okie doke amnesia problem vote youll sorry,Democrats,comment,lib,544
there zero chance going make anyone change mind talking one thing trump absolutely fine likely less 24 hour away saying something crazy immediately remind everyone narcissistic turdbucket genuinely dont think going make anybody forget anything might day two moderate voter believe might swayed towards voting orange van gogh there month actually vote plenty time remind really two week advantage might gained gone shooting forgotten quickly gop forget every school kid get shot weekly basis america,Democrats,comment,lib,126
speaker johnson say rhetoric need turned people need pressing daily precisely rhetoric coming left official point random twitter post nobody yet right literally congress member governor state official administration defacto leader like trump,Democrats,comment,lib,57
remember sarah palin used gun target imagery one political graphic remember trump talked second amendment people could hillary clinton dont gaslit america,Democrats,comment,lib,45
heard trump rally shooting victim identified felon rapist child molester shared underage girl epstein make full recovery minus part ear,Democrats,comment,lib,36
also looking like one far know registered republican wearing merch right wing progun youtube channel assassination attempt,Democrats,comment,lib,27
honestly sick pulling ad stuff right reanalyzing messaging democrat immediately take implied responsibility dialing rhetoric 310 meanwhile trump retweets good dem dead dem,Democrats,comment,lib,26
sick saying dems fault saying trump want dictator like literally said want dictator guy tried take trump said left,Democrats,comment,lib,30
remember gun pin wore agitate libs wonder still wear earshot away trump,Democrats,comment,lib,24
former president suggested iowa school shooting people get it… ok got shot so… get,Democrats,comment,lib,22
convicted felon often make poor decision find dangerous situation violence occur hopefully convicted felon turn life around incident statistic suggest otherwise,Democrats,comment,lib,17
trump could passed assault weapon ban didnt remember day republican would least occasionally take responsibility action yeah barely remember mid 70 either,Democrats,comment,lib,18
piss somehow going work ill never understand shit literally since 2008 probably way longer one time violent event affect must turn rhetoric democracy end okay well there nothing worried trump denounce project 2025 denounce kkk nazi supporter dont wan na hear single violent peep trump moving forward bloodbath biden win blood shed left allows,Democrats,comment,lib,46
putting trump age perspectivetrump currently 78 8 year vp 8 president walz would 76 trump elected oldest president u history 82,Democrats,post,lib,34821
democrat pulling uno reverse card calling trump age hilarious thing im,Democrats,comment,lib,13
donald trump older new york knicks basketball association america eventually became nba began november 1946 trump older founding baa member knicks boston celtic,Democrats,comment,lib,25
trump hang hat sail sunset would 82 end term old chief executive anything let alone united state america \elon musk july 2022,Democrats,comment,lib,24
trump loses run 2028 one year older age account old president ie bidens current age,Democrats,comment,lib,7
medium business selling outrage news optional kamala represents time politics head 247 thats bad business one tune boring politics aka governing properly trump 247 lowlight reel keep people hooked 247 thats good business,Democrats,comment,lib,709
yep double standard shes democrat shes trump dont think second also double standard shes woman vote harriswalz vote blue time make woman powerful person world,Democrats,comment,lib,277
said word became popular could get worse trump day maybe never weirder trump ever say perfect confidence one ever weirder trump,Democrats,comment,lib,125
truly wrap head around behavior weird guess brand current gop mean melania baron think behavior odd may wrong took loomer 911 ceremony instead wife also loomer 911 denier like make make sense really hope kamala win cant take absurdity anymore,Democrats,comment,lib,52
simple explanation medium bias democrat many democratic national politician stated intend raise tax wealthy republican politician universally promote tax cut patron wealthy wealthy easy choice wealthy control virtually corporate medium outright entire right wing propaganda machine dominate mainstream medium via stockholder pressure andor advertising blackmail accordingly virtually news report reflect wish wealthy make dems look bad polish gop crap think wealthy despise trump least much represents tax break chaos surround advance nation towards ultimate goal plutocracy wealthy pay tax able pas fortune intact generation illegal treasury give money anyone wealthy,Democrats,comment,lib,41
already tried make kamala harris hoe saying willie brown mistress isnt press turning eighty sex scandal like gary hart,Democrats,comment,lib,10
there definitely awkward conversation going right news room decide cover since bill clinton position dont care president presidential candidate sleeping policy action office care,Democrats,comment,lib,5
know beaten death but… imagine biden harris obviously abandoned family spouse even living started photographed handson member entourage significantly younger imagine credible evidence affair year imagine lowlevel staffer sudden cozy biden getting twitter insult contest nancy pelosi god would 24 hour news cycle would obama handcuff family value join list thing ive realized dog whistle along patriot gun right etc,Democrats,comment,lib,4
complaining mark hamill expressing belief okay dana white hulk hogan elon musk name celebrity vocally supporting trump large platform front million hulk hogan even gone far attack kamala race campaigning trump mention dana white allowing ufc live turn political rally trump even allowing fighter mic openly support trump telling fan keep state red conservative taunting side yet people okay telling hamill taylor swift dont dare get political stay lane leave politics double standard,Democrats,comment,lib,189
mean play joker know sociopath mean although would vote joker trump day,Democrats,comment,lib,14
people complain hollywood liberal get super excited hulk hogan clint eastwood say conservative thing,Democrats,comment,lib,9
always luke skywalker girl everyone else swooned han solo chose well ☺️,Democrats,comment,lib,6
weird thing ever read comment instagram post trump people like cant believe went dark side meanwhile part side literally nazi 🤷🏻‍♂️,Democrats,comment,lib,4
like great story mr frodo one really mattered full darkness danger sometimes didnt want know end could end happy could world go back way much bad happened end passing thing shadow even darkness must pas new day come sun shine itll shine clearer know folk story lot chance turning back didnt kept going holding something there good world mr frodo worth fighting,Democrats,comment,lib,114
came visited u wisconsin democratic party office day really chill guy shook hand heard story seemed humble nice imagine actor,Democrats,comment,lib,46
met sean astin comic con sweetest guy ever funny humble downtoearth normal,Democrats,comment,lib,14
clown world stuff hereim continually stunned cult base moral bottom support treasonous coward matter okay change okay receive new information form different opinion someone something thats personal growth,Democrats,post,lib,23715
comment reddit morning asking isnt kamala arlington news broke clearly prepping story missing ceremony,Democrats,comment,lib,1303
think labor day armed service related holiday memorial day year djt referring biden human scum playing keyboard warrior truth social word thanks gratitude fallen president bestowed traditional wreath anc harris also,Democrats,comment,lib,109
breaking news convicted felon break law complains crime rate ironic illegal politicize military good reason military defends country built democracy defend political ideology,Democrats,comment,lib,381
sane political paradigm longer b msnbc giving traitorous bastard air time c still allowed walk around free full frontal warp 10 pushback,Democrats,comment,lib,113
sane world grab em pussy mocking special need people rape affair stripper third wife cheated second wife side piece wife 1 home new born son 30+ felony conviction way ended campaign,Democrats,comment,lib,26
interesting bot spammer pushing exact narrative soon picture released ton trump honoring fallen soldier biden vacation post spamming reddit,Democrats,comment,lib,47
saddest part read headline reaction equivalent seeing commercial random product behavior become normalized par course doesnt even give reaction anymore,Democrats,comment,lib,20
sane world trump would impeached removed office 6 month term wouldnt even,Democrats,comment,lib,12
worth mentioning trump played long game lost 2020 election sabotaged afghanistan pullout accused advisor demanded release thousand taliban fighter also recklessly drawing troop make orderly safe departure afghanistan impossible he posing family soldier irresponsible action got killed acting like event harris skipped,Democrats,comment,lib,13
resigning shame always thing complete destruction concept shame mental health boom might appear,Democrats,comment,lib,6
thought family invited donald dont think invited right … would show uninvited,Democrats,comment,lib,13
trumpys blind unable see however veteran desecration american hero showing stupid think everybody,Democrats,comment,lib,9
hope shes learned biden hillary cant beat trump debate fact check lawyer person need call make look stupid weird dishonest,Democrats,comment,lib,1189
kamala seems prepared debate anticipate fact checking clinic thing conservative campaign attack apply much more…,Democrats,comment,lib,227
listen speech doesnt technically agree say hell 3 debate fox first bluff another trap shift blame im sure wont,Democrats,comment,lib,44
he definitely going go toddler one long continuous scream tactic used biden 2020,Democrats,comment,lib,24
oh goodyhow long msm begin accusing kamala backing fox news debate never actually agreed,Democrats,comment,lib,22
able stop making pathetic personal attack like shes crazy dumb probably slip racism misogyny keep bringing back people need deserve,Democrats,comment,lib,20
slated 2 hour debate may go said there plenty time factcheck every response question candidate important accommodated democracy depends,Democrats,comment,lib,16
wait didnt trump want 3 debate one fox true lmao tweet cause lock abc debate without committing others,Democrats,comment,lib,11
bidenharris administration shockingly competent surprising upside doubt passed inflation reduction act chip act infrastructure bill much administration outmaneuvered republican need get john r lewis voting right act passed harriswalz administration,Democrats,comment,lib,85
seen viral tweet suggesting pete buttigieg single handedly resolved port strike acting labor secretary julie su woman less visibility union hq day yesterday working tv ilas president called su terrific fyi,Democrats,comment,lib,26
okay pete really great havent seen photoshopped image wading floodwater tweeting lie endanger people,Democrats,comment,lib,14
old mayor going future president ive pleasure vote elect twice office life cant wait vote third time president,Democrats,comment,lib,49
side preparing petes eventual presidential nomination ready democrat know he future party calm logical wellspoken veteran strong policy stance everything could want candidate right already smear every chance get weird move guy who secretary transportation wouldnt go hard didnt know eventually he going democratic frontrunner,Democrats,comment,lib,7
personally prefer kind quiet solid competent leadership exhibit idk electable thatd national stage though itd probably work midwest cuz seems aligned people national politics favor loudmouth unfortunately especially big medium center coast,Democrats,comment,lib,19
pen bio architect deal art real piss conman diaper donnie would certainly sell better,Democrats,comment,lib,5
cant wait vote pete pres time come he prebeard stage star trek ryker,Democrats,comment,lib,4
ive noticed yes become really popular lately let forget always prime example elite democrat big money donor periodically met richest people country also fighting need nowhere near left bernie aoc,Democrats,comment,lib,3
conservative christian mother sent text morning debate jaw dropped read replied toddler granddaughter thanks voting future,Democrats,post,lib,15725
mom hasnt voted since bill clinton going go vote wife vote kamala said shes sick hearing trump,Democrats,comment,lib,1521
74 year old father never voted told dont care never vote im proud say registered ready vote november even got husband register vote first time,Democrats,comment,lib,251
wish could compile story one document would love see list keep growing,Democrats,comment,lib,211
im sitting california cry havent hopeful country inn 16 year literally insane whats happened basically 2 month,Democrats,comment,lib,70
exactly husband said would thing get people switch feeling harris inspires hopeful exhilarating feeling trump inspires cold terrifying exhausting,Democrats,comment,lib,52
short month ago anyone else believe less two month since joe officially dropped thought republican speaking dnc convention made sick sort effort reach conservative voter would go well never trump movement take page dl hughleys book say wrong really seems like putting time work humility passion needed reach republican politician voter really starting pay course election still isnt yet jury still sane republican really keep word vote kamala revert back party politics actually pull would win harriswalz campaign america might really able prove really pull back brink outright fascism,Democrats,comment,lib,78
apolitical dad unfortunately drank koolaid 2016 voted first time ever conspiracy lie misinformation batshit coworkers he delved craziest corner maga love hope snap election,Democrats,comment,lib,83
😲 color cynical expected read woohoo 🙌 hooray 😃 eureka nice im happy u good know,Democrats,comment,lib,28
high school went campaign barry goldwater another right wing extremist republican first assignment go democratic hq steal material dispose last time ever supported republican time proven decision correct,Democrats,comment,lib,25
think reasonable people sick politician actively trying divide u disagree policy without mean demeaning id prefer trying solve problem nothing politician see winlose situation rather acknowledging compromise progress step forward sometimes important,Democrats,comment,lib,36
wish story like insane conservative christian aunt think jesus saved bullet save u end world something equally insane,Democrats,comment,lib,15
mother law called yesterday told voting democrat first time 40 year never voted trump still voted republican state say support anyone party allows scary man word run president im proud,Democrats,comment,lib,15
wish mom bad able intellectual conversation election would mean much trump stole miss much happy youre lucky,Democrats,comment,lib,10
medium coupla goto stfu button democrat left general one time politicize issue course entirely absent rightonright violence perfectly acceptable politicize magic stfu button hey whoa everybody tone dont point who 95 percent rhetoric 99999 percent actual violence,Democrats,comment,lib,488
every year like christmas boy get milkfed suburban blue reach available arsenal saunter make news ani difranco,Democrats,comment,lib,37
got told yesterday make shooting political uhwhat 100 political wasnt made people make head hurt,Democrats,comment,lib,26
white boy need fucking chill edit im white boy im allowed say,Democrats,comment,lib,204
registered republican yet everyone blaming democrat dont want violence want people rally evolve grow,Democrats,comment,lib,73
schoolmate mentioned bullied relentlessly seems common denominator society need better prevention,Democrats,comment,lib,22
oh dont forget gem heritage foundation president kevin robert facing blowback wake comment ongoing second american revolution remain bloodless left allows,Democrats,comment,lib,6
apparently ar registered doesnt change damn thing someone mentioned correction dm,Democrats,comment,lib,8
see he planting seed word cheater cult follower guarantee theyll start using,Democrats,comment,lib,327
literally watching pov video someone arizona rally giving another perspective enjoying watching staffer member working event biggest takeaway everyone always smile face feel like good vibe emanating body language every person contrast trump rally look like people checked called upon cheer 3rd fire brimstone mass week,Democrats,comment,lib,194
aid lmao thanks telling trump clearly know campaign creates fake photo cheat campaign interferes election cheat ballot box got,Democrats,comment,lib,187
easily debunkable lie told hurt feeling see harris woman think little getting larger crowd energized supporter he getting,Democrats,comment,lib,136
geez first big major whopper lie office inaugural crowd even made national park service lie made spokesman lie lying liar,Democrats,comment,lib,60
already dropped kamabla low energy sad derogatory nickname enemy campaign cant even,Democrats,comment,lib,25
jesus… look right side order kid guide president trump gift bundle mike huckabee free fucker enemy country,Democrats,comment,lib,319
trump win hell claim mandate authoritarian rule arguing people want hell say democracy chose dictatorship make wonder election rigged way saying something bold would risky otherwise unless knew outcome he laying groundwork argue everyone knew intention voted anyway,Democrats,comment,lib,87
trump went russia north korea inspired upset vote people everyones sake vote especially youre young,Democrats,comment,lib,132
get november there going significant historical change made good historical change regressing,Democrats,comment,lib,49
many trump story begin shocking moment mf hasnt shocked decade every time read newest thing said im like yeah sound like bullshit would say,Democrats,comment,lib,10
trump smart enough understand authoritarian talking point goon keep repeating told say someone else,Democrats,comment,lib,9
many people country zero idea mean live dictatorship going around wetdictator day one tshirts hope every ounce outvoted landslide,Democrats,comment,lib,6
ill tell whats weird mocking special need kid proud parent something maga know nothing,Democrats,post,lib,14445
maga confused child loving parent… talk weird party claim pro family 😂 anyone imagine one trump kid cry pride nope 🤦🏽‍♂️,Democrats,comment,lib,1909
completely alien experience life one entire life proud theyve reduced tear,Democrats,comment,lib,241
former republican one example im never going back republican day excuse cruel mean letting better angel shine conservative american christian plain evil,Democrats,comment,lib,112
spread word everyone republican think weird son express pride father republican antidad,Democrats,comment,lib,206
fyi tim walzs son adhd nonverbal learning disability make difficult detect pattern work written information english math intellectual disability im throwing special need certain connotation lot wellmeaning people making assumption kid based one moment necessarily reflective general affect edit terminology correction,Democrats,comment,lib,662
ugh ghoul still alive walk around cross necklace prominently displayed oh christian surprise considering company keep,Democrats,comment,lib,35
wouldnt expect anyone make fun someone emotional shes actually targeting minor would ann coulter,Democrats,comment,lib,24
dad vote trump simply never said best answer gon na death working class inflation keep promotinganything send show definitive proof biden harris responsible high inflation actually helping problem trump would make worse,Democrats,post,lib,13559
reading dad economist say inflation would worse trump biden second trump term could actually make inflation worse trump would make america inflation crisis worse 16 nobel economist warn,Democrats,comment,lib,1
tell enjoy 10 increase imported good trump want implement gon na u pay tariff,Democrats,comment,lib,1288
democrat inherited collapsed economy decimated global supply chain global pandemic required bipartisan effort started trump pump billion dollar stimulus saved many american falling crack short term led increase price long term jfc voter really memory goldfish,Democrats,comment,lib,352
inflation still bad dad able explain bidens policy led jerome powell saying yesterday time come rate cut,Democrats,comment,lib,575
revisit conversation father couple week fed lower interest rate start casually peppering line trump tax talking cost consumer good godawful tariff plan,Democrats,comment,lib,81
already pointed whole world economic problem included higher inflation result pandemic biden managed get control faster developed country u economy better everybody else unless he indicated he willing see proof youve already done,Democrats,comment,lib,54
im sorry dad far gone cult mentality mom well keep trying bring inflation done corporation president wont listen bring right woman torn apart kind hears also rule thee type person isnt even registered vote idk,Democrats,comment,lib,22
ill never understand average people think someone like trump relate care,Democrats,comment,lib,23
border keep hearing friend family still voting trump get willing put end democracy cheaper price deportation thats take stop right vote mind boggling also leave part theyre making almost double income,Democrats,comment,lib,19
perhaps need refresh memory reagan recession bush srrecession clintonbalanced budget surplus bush w total economic meltdown obamarescued economy growth trump add 7trillion deficit 30mil file unemployment bidenrescued economy fastest economic growth history,Democrats,comment,lib,34
current inflation 29 he retired enjoy medicare privatized possible cut benefit remember 4 year trump administration tried cut social security,Democrats,comment,lib,14
lie pay republican inflation way fact reality matter sinclair fox news matter,Democrats,comment,lib,14
parent would tell theyd remembered someone voted narcissistic tyrannical leader attempted destroy american democracy ego big admit dont understand economy work,Democrats,comment,lib,11
ignorance doubling lack knowledge people know nothing economics never cease amaze he literally listening lie saying must true reason guess instead looking issue determining best actually think fat joffrey going better working class he lost cause im sorry read word larger 5 letter get one naked economics undressing dismal science charles wheelan myth rational voter democracy choose bad policy bryan caplan deficit myth modern monetary theory birth people economy stephanie kelton relatively simply written book president role economy basic economics good one beginner help understand economics working class feeling based said wont read even gave though he walking bag cognitive dissonance,Democrats,comment,lib,11
agree sentiment damn sharing real straight disinformation there plenty real quote walz worth sharing fake one anyway,Democrats,comment,lib,26
august 60th libs trying take calendar extreme left want overthrow time tune fox news discus frightening discovery,Democrats,comment,lib,4
really best part would think best part one step away presidency,Democrats,comment,lib,3
maybe incredible momentum doesnt come new habit reveling outright fake online b thats guy,Democrats,comment,lib,3
mom often cycle name kid landing right one sometimes 30 everyone time nobody ever notice common everyone know person meant,Democrats,comment,lib,29
voter dont care concerned detail democrat higher expectation seems issue delegate elected official base enough say need new nominee propose replace biden logical choice harris dont think independent vote number need,Democrats,comment,lib,115
except every time biden screw everyone latch like crazy trump one seems care crazy double standard today,Democrats,comment,lib,9
president biden slight favorite 51 win electoral college wtf want get phone moronic socalled leader dc tell stfu hand almost feel like b firing base make damn sure president biden win,Democrats,comment,lib,33
im voting biden know current democratic candidate one isnt felon one doesnt rape 13 year old little girl hang epstien one didnt steal hide refuse return classified document one isnt threatening jail worse enemy one isnt quoting hitler one isnt taking womens right lgbtq+ one actually job doesnt golf day im voting standing behind candidate dont replace people keep spending next 4 month bashing himyou helped trump win biden ballot going convince people stay home stand fascist,Democrats,comment,lib,29
biden say thing wrong news everywhere trump rape child cant single story wonder many billionaire news company also pedophile point seems like,Democrats,comment,lib,5
100 issue old make verbal mistake one convicted felon pedophile rapist wouldbe hitler talk banging daughter really choice hard,Democrats,comment,lib,5
democrat currently locked circular firing squad remember trump thats enemy biden,Democrats,comment,lib,3
crazy fast people forgot got trump pedo rapist biden accidentally called zelenskyy putin,Democrats,comment,lib,3
