text,subreddit,post_or_comment,expected_political_leaning,score
another area people side politics agree scare fuck politician feel like somehow national citizen initiative passed buying selling stock law sitting politician would immediately call bipartisan session would unanimously agree citizen didnt know fuck reverse law,Conservative,comment,con,7
sad republican abuse often democrat course party even remotely considering banning kind trading atm dems,Conservative,comment,con,8
happens electorate apathetic willfully ignorant dont hold representative truly accountable simple,Conservative,comment,con,4
saw wall street bud fox gordon went jail insider trading different,Conservative,comment,con,2
much respect evan vucci took picture photographer sound bullet still ringing air rushed take knew going defining photograph history america,Conservative,comment,con,1130
time cover hoping photo hit street wasnt sure theyd print im sure make look way heroic liking badass presidential photo lifetime im young,Conservative,comment,con,486
least time sense use incredible picture nyt deliberately chose angle cut flag,Conservative,comment,con,354
fair enough least dont pretend fell like cnn cut picture show flag like nyt,Conservative,comment,con,87
guarantee photo going inspire people vote cant even look without feeling patriotic fuck,Conservative,comment,con,97
ive noticed time started fair least cover there one talking biden walker old people u seal,Conservative,comment,con,95
know probably active shooter training received like stay low usss guy kudos trump defying showing he afraid people,Conservative,comment,con,57
whole response instinctual man generally showman he also god damn fighter,Conservative,comment,con,33
holy shit comment political page right show far people become brain rotten everybody echoing 2 thing 1 staged demonize left 2 better shot biden democrat would absolute chaos unfolding riot gun ownership protesting every single republican threat upon threat retaliation fucking backwards world,Conservative,comment,con,1044
anyone saying staged wish shot didnt miss disgraceful one wishing violence political opponent matter said trump 2024,Conservative,comment,con,57
remember making staged shot close without actually killing person practically impossible,Conservative,comment,con,26
whats wild meon social medium see people claimed right wing conspiracy theory biden mush brain last several year suddenly saying right winger shot trump galvanize base staged conspiracy theory bad evil realistic 1000 literally happened clown world live going throw conspiracy would far plausible democrat agent known fbi sure hoping elicit right winger respond shooting current president sometime near future biden ever suddenly rally outside open cover around maybe set good grief hell antic like supposed happen modern society america vote opponent take,Conservative,comment,con,77
biden condemned shooter least there never forget said earlier week put trump crosshairs,Conservative,comment,con,58
12+ hour later still isnt featured trending reddit youtubes home tab doesnt breaking news blurb showcasing video hmmmmm,Conservative,comment,con,7
paul ryan freaking time get as spine get trump train secure wisconsin u like 2016,Conservative,comment,con,35
id like see many others follow less want third world country btw consider giving tesla try least dont push fake dei bullshit rest build america,Conservative,comment,con,43
whats wild essentially inadvertently dodged bullet appears shot intended hit looking slightly ahead looked right instant round went immediately grabbed ear turning head like removed portion head would struck round,Conservative,comment,con,2
laugh want without sizable percentage people also think like biden easily elected cant win presidential election strategy doubling base didnt work bernie wont work trump,Conservative,comment,con,24
surprise wish would let u know think held nose voted rat,Conservative,comment,con,91
representative owes industry judgment betrays instead serving sacrifice opinion edmund burke member british parliament,Conservative,comment,con,54
ashamed really liked voted even donated campaign 2012 he really lost mind,Conservative,comment,con,34
look like duck smell like duck quack like duck probably duck republican fund distributed mitt mallard,Conservative,comment,con,8
republican saying decade wasis opportunistic nobody would go along anything thought would bring success dad good governor michigan son accomplishment public service anything write book everyone know always rino one trusted keep supposed belief heart started coming,Conservative,comment,con,4
tiger wood also took heat claiming different root outright claiming african heritage oprah,Conservative,comment,con,539
give woman 🏆 need label people based color skin ethnicity proud american 🇺🇸💪,Conservative,comment,con,501
controversial way also american purple hair best purple hair also also ok label literally despite obvious anything american,Conservative,comment,con,61
best friend growing half jamacian mom hated term africanamerican loved jamaican heritage felt dismissed label nobody call egyptianamerican african like guatemalan peruvian doesnt like call mexican,Conservative,comment,con,55
thats definition someone build entire identity around race gender someone solid,Conservative,comment,con,72
spot white american dont feel need specify european american eg italian american irish american fine,Conservative,comment,con,87
oprah implying raven something wrong shameful shame oprah also disney cool back,Conservative,comment,con,47
im already seeing spin thats dangerous area war zone also said walz served war italy,Conservative,comment,con,805
people trying fact check hilarious painfully obvious theyve never military theyd recognize inside tent would understand opsec arent gon na come say,Conservative,comment,con,583
gosh hope coc doesnt see thisif getting dogsh\t smoked worse happened u,Conservative,comment,con,87
yup loved fact moderator instantly fact checked trump springfield let kackala get away much b,Conservative,comment,con,124
played nonstop trump rally frankly everywhere american imperialist regime along loss life name greed lie money end,Conservative,comment,con,34
abc fact check military men figment imagination kamala harris comment verified fact,Conservative,comment,con,55
see left saying guy trailer active duty combatwar zone since didnt say,Conservative,comment,con,28
id terrified post active duty end day kamala still vice president second charge potus bos rule different military get shit ton trouble posting stuff bashing chain command especially uniform,Conservative,comment,con,18
even people really dislike trump legitimate reason far fewer people killed leadership didnt start getting people killed new placesunlike basically every president last 90 year think thats pretty good trade v mean tweet,Conservative,comment,con,13
id like mention opinion extremely readable people like legal background id encourage anyone strong feeling either way opinion actually read took maybe 30m learned lot,Conservative,comment,con,803
good dont want president immunity isnt trump argument setting precedent president going forward president held accountable criminal conduct office includes biden trump clinton future president,Conservative,comment,con,2138
doesnt need immunity ill trade protecting trump biden immunity road republican leader must willing subject law want trust people,Conservative,comment,con,961
yeah never winning good reason branch keep check president immune judicial branch would essentially give u king rather president,Conservative,comment,con,789
defense speaks mindset president want multiple member administration resigned fired repeatedly telling limit presidential power im saying want dictator im saying seems incapable wrapping head around job view presidency ceo country,Conservative,comment,con,292
youre conservative good thing also right decision precedent would set road dictatorship fear onewayrule nothing happen biden obama clinton dem president follow biden happening trump there ever republican president elected itll happen,Conservative,comment,con,5
believe dc appeal court wasnt going win regardless win everyone think next stop scotus,Conservative,comment,con,-12
honestly find concerning still actually people buy narrative believe somehow good country hell people last 4 year freaking rock look aroundi mean really look around entire u turning dogsh\,Conservative,comment,con,16
one many lie told allowed fact checked course supporter say well say anything different racist misogynistic terrorist got ta love,Conservative,comment,con,16
im starting feel confident maybe gon na let lose go vote make landslide,Conservative,comment,con,3
biden mentally fit president ever oh yeah dont know obvious mental decline kamala come fix issue since weve presidency 12 last 16 year trump racist felon racist,Conservative,comment,con,26
take step market today theyll say thats biden harris market today theyll say fallout trump policy freaking secretary commerce didnt even know board labor statistic trump stated job number overreported 800000 theyre simply incompetent dishonest pile crap ever seen 30+ year following politics,Conservative,comment,con,25
honestly would respect kamala candidate invoked 25th amendment along member cabinet truly cared america would,Conservative,comment,con,27
reported reddit care resource yet made post day first post actually got attention saw message someone concerned reported reddit care resource lol,Conservative,comment,con,6
love fox new front center call controlled opposition hard rest em,Conservative,comment,con,57
saying economy great biden like calling jeffery dahmer vegan scariest thing bidenomics could legitimately get worse kamala,Conservative,comment,con,9
argument obamacare obamacare iswas great 2016 dems running fixing healthcare p need fixed saviour charge saved u obamacare also good laugh black dem woman cry cant pay medical bill didnt insurance asked didnt insurance since obama voted mandated insurance believed obama much didnt listen said need healthcare else pay fine,Conservative,comment,con,3
kamala cant even fix hair make properly let alone fix economy helped right along biden destroy as got ta go,Conservative,comment,con,0
definitely confusing message maybe explain better next interview probably around january 7th,Conservative,comment,con,-1
u talk show host tucker carlson slammed traitor pictured russia ahead sitdown interview putin,Conservative,post,con,3183
putin hate america dismantled ussr greatly diminished russia geopolitical power friend,Conservative,comment,con,139
dont understand folk dont understand russian government criminal organization oligarchy case fancy mafia invasion 2014 2022 putin attempt capture control commodity market natural gas wheat sunflower oil uranium others subjugation ukraine oligarch could control thus corrupt huge commodity market lining strengthening russian aggression europe stop russian corruption forced stop later u know disable mafia let russia btw way funding ukraine still see russia threat must stopped dont choose one side need make smart choice,Conservative,comment,con,493
im definitely waiting interview making judgement dont much hope gon na anything softball carlson putting lot prorussia take recently ive seen doubt hell try push hard edit lol couple minute posting get reddit care message suicide prevention,Conservative,comment,con,923
putin propagandist love tucker quote republican killing ukraine aid dont see gigantic gift keep giving putin thats traitor thrown around living reality,Conservative,comment,con,21
dont issue journalist interviewing putin tucker wrong guy segment russia devolved parroting kremlin talking point nazispersecution christiansetc hopefully im wrong likely going pretty softball interview ol vlad,Conservative,comment,con,551
russia bad actor 100 u interest view equivalent jane fonda vietcong apologist could say he interviewing public figure aljazeera interviewing hamas leadership journalist question history biased reporting favor international foreign entity hostile u interest freedom press still hold support tucker ability report enemy territory although take commentary big grain sodium chloride,Conservative,comment,con,217
immigrated russia family also family raised service marine one thing convinced russia would better without kleptocracy draining watching awe u sold river talking bobbleheads bought ruble tucker people like dangerous like mini goebbels walking around betcha solovyev crooning year,Conservative,comment,con,85
тhe fact russian ready buy one thing fact american ready sell surprising,Conservative,comment,con,86
lol pro russia shill force today sure traitor afterall interviewing tyrant doesnt make bad let act like tucker hasnt pro russia war russia ally like u vision world one top theyre friend iran china syria north korea putin objectively awful enemy simp support instead oppose,Conservative,comment,con,40
shock guy parrot russian propaganda kremlin talking point chumming russia cant wait softball interview putin god stand insignificant part party love affair russia,Conservative,comment,con,45
listened tucker carlson many year sometimes agreed point view sometimes havent dont understand anyone could label traitor might might talk putin later say something along line putin hero right usa great satan yes could see attaching negative label happened personally wait see happens make judgement,Conservative,comment,con,258
reckon hell ask putin meant said u centre new world order haha kidding interview happens theyll probably talk death journalist gonzalo lira probably lbtq degenerate west blablabla,Conservative,comment,con,34
anyone throwing tucker carlson bus without hearing side bad democrat believed false allegation trump democrat owned medium,Conservative,comment,con,5
dont care liberal done he asshole like getting close putin isnt good u fan flame republican licking boot putin,Conservative,comment,con,34
traitor interviewing putin would though normalizing evil like american interviewed hitler 39 stinking clue many conservative like putin he leftist exkgb commie trying best piss u friend get bed enemy namely china iran completely disgraceful behavior conservative like putin,Conservative,comment,con,30
defending putin funny people dont see u government bombing whole middle east killing million civilian process u government better worse puting look fact unfortunately…,Conservative,comment,con,3
todd beamer american hero fellow passenger gave life stop united flight 93 reaching target september 11 2001 last recorded word let roll,Conservative,post,con,3176
memorial believe 3 time solemn feel like everything get quieter youre also passenger revolt scene movie never make cry like baby,Conservative,comment,con,202
todd beamer man aspire like grew knowing name one dad friend worked young still batman shocked someone looked ordinary could hero rip,Conservative,comment,con,67
watch united93 every year 911 time handle watching movie tough… every time end always hold hope theyll make cockpit theyll get control theyll land…i know ending still hold hope gosh hero sky looking death face saying wont go without fight,Conservative,comment,con,25
try watch film united 93 every 911 handful despicable coward day many hero,Conservative,comment,con,125
think lot true courage men would like think would terrible situation like best u,Conservative,comment,con,37
true american hero every school kid taught name story bravery sacrifice instead get pride flag story george floyd pray todd sacrifice vain,Conservative,comment,con,146
one spirituality time strict rationalist early career came consult department company time felt something different strong christian know explain felt thought time man destined good lifehis spirit seems shine something special positive love mankind guy soooo positive way demeanor self slightly envious wishing life guess aura sort really word describe like spirit shone unseen eye way though week month never forgot differentdifferent anyone met shocked year later see let roll man looking back christian might say grace god way back,Conservative,comment,con,11
last word heard hope actual last word youre going piece shit terrorist,Conservative,comment,con,15
little park town named nice little memorial dedicated rest peace todd,Conservative,comment,con,3
context powell charged alongside trump 17 others violating state antiracketeering law entered plea day jury selection set start trial pleaded guilty six misdemeanor related intentionally interfering performance election duty part deal serve six year probation fined 6000 write apology letter georgia resident also agreed testify truthfully codefendant future trial nothing consequence,Conservative,comment,con,440
kracked pleaded guilty charge cooperating prosecutor racketeering case trump ally involved case trump never associated crackpot like woman lin wood helped discourage gop voter turnout georgia cost two senate seat clown going bite trump butt coming month testifying bad day today,Conservative,comment,con,283
fulton county prosecutor recommending sentence six year probation powell also required testify future trial write apology letter citizen georgia part guilty plea powell admitting role january 2021 breach election system rural coffee county georgia help local gop official group trump supporter accessed copied information county election system hope somehow proving election rigged trump,Conservative,comment,con,55
add context sidney powell cheeseboro requested speedy trial jury selection slated start today stand da two trial one powell cheeseboro another whoever left obviously ideal im sure cut deal guess bet talk cheeseboro find deal hell accept first trial go away,Conservative,comment,con,39
surprising given offered plea deal pay would less speeding ticket normal person jail time pay fine write empty apology letter nobody going read anyways shed crazy take,Conservative,comment,con,59
6 year probation lot better potential 20 year fed rico charge obviously dont know term probation work landscaping deal lot guy probation got ta drug commit another crime probation basically live life check hardly inconvenience long dont plan committing crime,Conservative,comment,con,13
less charge plea deal anyone would take going court always risk,Conservative,comment,con,5
hope time grossly irresponsible integral part complete derailing actually getting audit done election,Conservative,comment,con,3
last sentence entirely true biden made statement shortly mentioned attack although name said still biden said repeatedly first president american service member killed term completely forgetting men woman,Conservative,comment,con,463
never forget rip died tragic day service country hope family better,Conservative,comment,con,75
lol whatever… let focus joy provide kamala take november joe scarborough,Conservative,comment,con,80
really give warm feeling troop treated upcoming war distract dems failed policy,Conservative,comment,con,4
tweet link since took 5 minute scrolling find sound like reposted remove community note,Conservative,comment,con,103
went hating medium somewhat afraid imagine kind soulless evil put totally misleading headline like people absolutely morality anything power kind people hungrily see mean dangerous kind,Conservative,comment,con,13
par course wait probably offensive language since golf white man game,Conservative,comment,con,31
deleted reposted could get community note removed lol im sure worked though cant imagine many people read headline basked glory seemingly confirmed bias went another emotionally loaded dishonest news article title,Conservative,comment,con,11
blinkens face joe biden call chinese president xi dictator 😂😂😂 xi still u soil,Conservative,post,con,3171
would chinese offended call xi dictator know authoritarian government led one man power want world believe china free democracy constitution openly say communist dictatorship,Conservative,comment,con,691
like +1 bidens negative respect stat based thing he ever said,Conservative,comment,con,271
gosh see blinkin mentally adding east next trip place visit advert ww3 poor guy need vacation,Conservative,comment,con,131
fear people know lot letting asia concept anymore asia full problem,Conservative,comment,con,41
cant stop watching ha ha ha ha ha ha ha ha,Conservative,comment,con,6
distills difference liberal progressive jfk rfk particularly would probably recoiled woodrow wilson fdr postmodernist nancy pelosi would probably ask wrong statement,Conservative,comment,con,41
ie could setup chinastyle democracy vote one party disappear save democracy,Conservative,comment,con,27
immediately move russia venezuela cuba china asap thats possible shut hell,Conservative,comment,con,19
thing least adversary admit corruption russia china north korea deny political class ruthless least honest united state folk washington try hide try hide noble coat saving democracy think even worse propaganda would make goebbels melt joy,Conservative,comment,con,2
may well draft bill titled law remedy distress american people suspending check balance harris obama becomes supreme ruler country,Conservative,comment,con,2
putin started saying begin u need stop supplying arm negotiation start first need cede powerleverage negotiation,Conservative,comment,con,836
putin aggressor matter peace offered start military retreat back internationally recognized border way russian invasion rewarded anything fact putin justified invasion claiming ukraine historic land russia enough sane people see russia invader there way historic land argument brought justification military incursion sovereign nation,Conservative,comment,con,1236
try make case folk white house warmonger citing putin tommy dumberville,Conservative,comment,con,26
tuberville punished military almost entire year blocking promotion he fawning reasonable putin jesus going country wtf,Conservative,comment,con,900
russia aggressor conflict want war end go home itll putin invading grabbing bit country decade,Conservative,comment,con,1372
watching american republican conservative cozy cold war adversary putin somehow shared western value mind boggling lot problem ukraine—but comparison russians…,Conservative,comment,con,316
exactly putin want im necessarily interview representative lapping putin talking point embarrassing,Conservative,comment,con,939
number flaired conservative thread lapping russian propaganda straight trough fucking appalling russia aggressor invaded country pose threat madeup pretense ultimately resource still 1800s war end time russian leave,Conservative,comment,con,460
tucker able interview ever want dont mistaken putin invader pull military would tomorrow want crimea territory get nothing ethnic russian donbas nazi jew gypsy ukraine land port access natural resource,Conservative,comment,con,115
putin invaded ukraine hold key easiest peace agreement would withdrawing troop propaganda sure side bullshitted plenty well ultimately russia invaded ukraine easiest way peace withdraw,Conservative,comment,con,82
really frustrates people believe single word say could u end war cutting money weapon yeah maybe would also handing semi democratic country dictator also could end war immediately by… removing troop,Conservative,comment,con,22
interview unhinged imagined already going dont know screenshot person believe anything putin say sadly misinformed like putin logic basically land owned someone else land go back homeowner hate one trick technically russia part ukraine gon na give credibility word ukraine take russia back,Conservative,comment,con,9
yeah palestine open peace deal oct 8th nazi open peace deal 1943 japan would loved peace deal 1942 dont get conquer region say victim lack peace deal russia peace deal force ukraine capitulate leave ukraine open peace deal,Conservative,comment,con,26
money defense contractor boost economy tie adversary foreseeable future demonstrates superiority modern american weapon system making country like morocco indonesia think buying u rather russia oh demonstrates adversary like china committed containing influence making think twice disrupting country anything war going amazingly well u obviously putin want u stop,Conservative,comment,con,16
trump campaigned putting boot putin think hed clean election top bottom like made policy talking point conciliation ukraine,Conservative,comment,con,53
didnt show full cut actor jonathan pryce two pope looked like wanted fucking murder ricky remember cackling moment edit here full speech,Conservative,comment,con,270
love really tv exec wouldnt allow afraid saying know say nothing happen theyre laughing untouchable hollywood abuser ricky great tho,Conservative,comment,con,23
ricky gervais hosting possible reason would ever watch golden oscar globe,Conservative,comment,con,26
love ron he tremendous governor meatball ron meant meet ron best governor america big supporter friend campaign trump 24 hour,Conservative,comment,con,781
every gop nominee since 1968 besides trump george w bush previously ran lost primary general election people acting like killed future chance dramatic reagan almost successfully primaried ford 1976 didnt hurt unpopular many republican time,Conservative,comment,con,404
great candidate running one worst campaign modern history cant think one conservative podcast dont recall seeing fox news conservative network,Conservative,comment,con,345
ill never understand nikkis campaign lasted longer ron someone tell storyline campaign started problem faced eventual death,Conservative,comment,con,163
