text,subreddit,post_or_comment,expected_political_leaning,score
quick ill send another 100 end convention well figured end acceptance speech quite folk donating,KamalaHarris,comment,lib,215
think ill every upvote post get ill donate dollar limit op potential candidate ive donated bernie primary 2019 election incredibly important please go register vote november donate 5 provide proof registered vote,KamalaHarris,comment,lib,125
524 doot know im past 500 mark could throw penny feel like still helped,KamalaHarris,comment,lib,92
far ive donating 20 per month extra kick get clever text,KamalaHarris,comment,lib,18
response harassment letter neighborwe put several harriswalz lawn sign week ago ended getting anonymous letter mail complaining sign copy letter banner stake front lawn everyone see,KamalaHarris,post,lib,18220
love better stronger hope hateful neighbor drive sign every day keep good fight,KamalaHarris,comment,lib,2353
brand republicantrump supporter really scare shit like fuck even talking even ignoring obvious racism baseless allegation red pill swallowed make believe trump a… better person harris 😂 vote harris silence scum like,KamalaHarris,comment,lib,216
also since mailed isnt law could considered threat please read… u postal inspection service website ever received letter scared threatened destroy reputation mailing like serious federal crime receive threatening letter report postal inspector keep letter evidence modern version threat letter called cyberbullying effect cyberbullying many way worse traditional bullying infiltrating every part victim life causing variety psychological struggle threatening letter serious federal crime use mail threaten person watch learn threatening letter cyberbullying postal inspector investigate source,KamalaHarris,comment,lib,246
fucking epic love libs finally enough decided treat clown like child,KamalaHarris,comment,lib,65
sign hilarious quote wife child stalker vibe creepy maybe time get glock like kamala usps mail protection call postal inspector report someone posted could cyberbullying keep record maybe try sus,KamalaHarris,comment,lib,34
😂 love rock fit remember obama tan suit controversy sooo stupid right grey poupon sandwich controversy,KamalaHarris,comment,lib,25
reagan clinton bush obama biden harris presidential line tancession broken orange man,KamalaHarris,comment,lib,13
didnt every president least reagan wear tan suit point pretty sure obama didnt start although make look best far,KamalaHarris,comment,lib,14
even president reagan looked good tan suit im thinking problem skin color suit color guess though,KamalaHarris,comment,lib,9
pure happenstance ten year day instead meant stick face republican outraged back right,KamalaHarris,comment,lib,3
19000 brother sister desert diamond arena seating capacity 19000 first time ive ever kinda wished lived swing state la la la,KamalaHarris,comment,lib,342
unexpected crowd age race vibe point john giles speech lit fire everyone well lot mccain republican still pissed gon na put trump shit,KamalaHarris,comment,lib,638
understanding stadium hold 20k look pretty full close way turnout arizona,KamalaHarris,comment,lib,156
holy smoke… knew biden stepping unleashing harris walz would equivalent lighting mammoth pile dynamite unbelievable scene glad happening u,KamalaHarris,comment,lib,101
cnn harris speaks another packed stadium full people let u tell bad news campaign,KamalaHarris,comment,lib,322
man even fucking arizona place yeah think got european pretty hopeful future,KamalaHarris,comment,lib,159
know already said bidens decision drop probably seen one biggest turning point history obviously theyll amazing speech convention exception harris walzs im looking forward final major address,KamalaHarris,comment,lib,66
omg thought trump seeing shitting brick brings much joykick imbecile curb let run board donatevolunteervote,KamalaHarris,comment,lib,35
got free ticket trump bozeman bad cant make much fun arizona,KamalaHarris,comment,lib,32
mom life deep red matt gaetz district got sandal make imprint daily walk beach 😎,KamalaHarris,post,lib,14495
saw one said fuck trump would easy someone erase first half pretty funny though,KamalaHarris,comment,lib,58
straight kamalatim site want 10 pair going south week 😈 walk everywhere,KamalaHarris,comment,lib,4
pennsylvanian approve billboard also good one pennsylvania eta someone pa put trump chicken since wont debate,KamalaHarris,comment,lib,129
remember tantrum trump threw black journalist convention attempt get back medium coverage covering arent covering harris tantrum arent news put toddler trump time,KamalaHarris,comment,lib,46
get one myrtle beach still trump country heck south park right still trump store,KamalaHarris,comment,lib,9
walz keep profoundly interested im convinced guy introduced weirdo rhetorical battle best choice mvp make good handling bully smiling anyone ive seen definitely connect independent upper midwest weirdo isnt especially appealing one secretary pete doesnt added benefit dispelling notion mvp radical san francisco communist,KamalaHarris,comment,lib,9
harris ad showing vance refusing say trump lost get one million view hour,KamalaHarris,post,lib,13345
there two thing debate need highlighted one response getting fact checked dont care side getting fact checked response shouldnt acceptable regardless candidate may well announced intending lie,KamalaHarris,comment,lib,562
dont show happened call happened cant jd vance answer question admits trump lost election hell crucified lie said trump hell hit hard left,KamalaHarris,comment,lib,192
campaign give much hope could watch last night jd scare much watched rachal maddows analysis later felt much better,KamalaHarris,comment,lib,66
walz ending night brilliant musician band tour knew played mediocre set wow end last song change people felt entire show thats exactly walz,KamalaHarris,comment,lib,20
poor shady vance even rapist donald trump say know lost election rapist donald trump admits lost 2020 election lied constituent stay shiny,KamalaHarris,comment,lib,9
need remember well refusal certify loss never forget jan 6 gaslighting forte,KamalaHarris,comment,lib,6
texan got tire slashed assume crime beto texas sticker car go trump 2024 year prison sticker,KamalaHarris,comment,lib,226
ive called much shit publix parking lot red light living panhandle anti trump sticker democratic support signsshirts ignore smirk drive trumpers even mad ignore dont give reaction want ill wearing harriswalz camo hat proudly come john heather mae trumpers publix dont like well damn fucking bad,KamalaHarris,comment,lib,458
im anyway silencing u threat violence literally terrorism grandfather didnt risk life fighting nazi ww2 afraid much wear shirt bumper sticker wannabe fascist dont like stand defiant kamala walz fellow member movement,KamalaHarris,comment,lib,205
wonder many woman show support trump front husband neighbor knowing full damn well never vote inside voting booth,KamalaHarris,comment,lib,78
currently live wv wife going putting harriswalz sign im going put bumper sticker car first time nothing supporting previous dems im lifelong proud democrat ive always picky putting stuff car fuck em america wv union state civil war wv got jfk elected president 1960 wv democrat,KamalaHarris,comment,lib,83
thank much id like brave voice political support cant im already part several demographic elevate chance assaulted targeted adding tim walz harris sign car would even inviting trouble cant defend afford paying property damage court lawyer came easy everyone take bold confident outspoken supporter ill always choose safety first protest show support really matter ballot box sticker tshirts though id really like show enthusiasm subtle way still bernie biden sticker previous year tucked wallet,KamalaHarris,comment,lib,48
dunno noticing lack trump related merchandise knoxville tennessee god awful confederate flag glad stopped seeing display foolishness people,KamalaHarris,comment,lib,29
live light blue state fairly public job kid id love wear shirt hat bumper sticker lawn signs… ala safety keeping job win see yall poll think lot u,KamalaHarris,comment,lib,26
ive thinking getting republican harris sign figure might slightly less target might make certain portion demographic consider joining ive never republican,KamalaHarris,comment,lib,24
ive talked couple republican woman whove said theyre even telling husband theyre voting blue,KamalaHarris,comment,lib,29
windshield wiper bashed rock parking lot motel visiting folk deep red rural ohio cracked windshield cost 500 nobody elses car touched nobody elses car biden harris bumper sticker im going remove replace bigger harris walz bumper sticker,KamalaHarris,comment,lib,30
live squarely backwards red state mo put bidenharris sign 2020 derelict stole cloak darkness put twice many next day stayed cycle ordered harris sign day bring chicken fucker,KamalaHarris,comment,lib,21
live ohio country surrounded trump sign ive never proud putting kamala president sign get fear though dont see sign red state doesnt mean arent,KamalaHarris,comment,lib,16
1991 van 1964 ford painted positive message need love fk war etc boulder thrown windshield people leave horrible note yeah love peace often met hatred destruction,KamalaHarris,comment,lib,16
love logic behind kid one right belief kid blessed like mary dont child deserve stoned ostracized even abortion anymore bullshit culture war want woman obedient trad wife told baby dont youre insulted demonized complain much sharia law muslim culture yet jabronis copying saudi arabia ever yet trump say suburban woman dont like geez wonder 🤔 maybe goofy vp pick call childless cat lady want place tracker try go state abortion,KamalaHarris,comment,lib,85
thats lieutenant mayor pete buddy yet another person talking circuit military experience gravitas vance,KamalaHarris,comment,lib,36
ive plenty friend army turn working supply chain louisiana important sniper syria left gop 2004 swift boat ad surprised still going low 20 year later fuckin hate republican party absolutely filled brim mean as idiot,KamalaHarris,comment,lib,20
also need keep saying harris two child shes bonus mom 10 year didnt birth doesnt mean isnt parent double fuck republican party claiming way woman mother shove baby body,KamalaHarris,comment,lib,21
deployed back day doesnt make service less anyone elses raise hand take oath dont exactly get pick choose thats part sacrifice serving armed force people make big deal deployed know thats fucking thing otherwise shitty soldier sailor airman,KamalaHarris,comment,lib,7
john stewart day talking child serving war joy watch love pete,KamalaHarris,comment,lib,5
make sad see old man badly sundamaged skin bleeding ear shouting incoherently like hope uniformed men dragging away take somewhere safe calm get help need,KamalaHarris,comment,lib,11
since idea photoshopped make two sign debate one trump quote eating pet kamalas reaction office depot print either day next day put yard window,KamalaHarris,comment,lib,14
getting worked likely photoshop want point op doesnt claim real think cute,KamalaHarris,comment,lib,3
im sorry everyone hasnt figured assassination attempt complete fake got real person killed fucking moron real trump would demanding way investigation would cornerstone campaign dropped less week happened barely talked know pursued going prison murder well,KamalaHarris,comment,lib,9
soon new york time new york time endorsed kamala harris here thats bad news kamala harris,KamalaHarris,comment,lib,1170
nyt editorial donald trump support better israel also support ambivalent harris also support glenn greenwald,KamalaHarris,comment,lib,121
excerpt text editorial republican support m harris recognize election something fundamental narrow partisan interest principle go beyond party 2020 board made strongest case could reelection mr trump four year later many american put excess mind urge may look back period nostalgia feel life much better three year ago recognize first term warning second trump term would much damaging divisive first kamala harris choice,KamalaHarris,comment,lib,77
yeah finally got fed cancelled subscription wont call trump atrocious behavior dont get money,KamalaHarris,comment,lib,56
nice theyve done much incredible damage biden harris campaign spent year normalizing trump carrying water lie bullshit,KamalaHarris,comment,lib,28
little late newspaper ever paid whitewashing trump going hard biden never became another rag shame love game,KamalaHarris,comment,lib,12
backhanded endorsement actually praised several trump policy criticizing throughout seriously screw nyt,KamalaHarris,comment,lib,11
translation reforming trump word coherence abomination fucking reporter editor need tell like meant say need stop inserting jason miller talking point trump rally trump doesnt actually use talking point quote trump directly without helping context clarity maga hate ny time republican dont like newspaper much theyre alienating base readership propping trump fat as dead arrival let reader know,KamalaHarris,comment,lib,20
good theyd actually start job report trump mental unfitness would great,KamalaHarris,comment,lib,15
breaking news liz cheney endorses kamalai saw twitter minute ago duke university literally said could vote donald trump instead going vote kamala harris,KamalaHarris,post,lib,10275
big news liz literally eldest daughter dick cheney one controversial vps modern time despite voting trump term congress shes built spine say shes choosing country party,KamalaHarris,comment,lib,1299
warms coldest part heart see people putting country party hope people continue come public support kamala let go 💙🌊🩵,KamalaHarris,comment,lib,250
smart move target message young voter young people voted rate older people republican would chance level government,KamalaHarris,comment,lib,170
obama 2008 campaign veteran never thought id see day cheney would camp welcome team liz glad board,KamalaHarris,comment,lib,475
surprised republican dont backbone renounce trump real conservative disgusted trump done gop,KamalaHarris,comment,lib,127
huge edited addfolks liz cheney staunch republican happens woman part rapidly growing list republican tired trump shit saying loud,KamalaHarris,comment,lib,69
may agree liz cheneys policy aboutwell anything respect hell refusal bend knee rapist loser con man im honored team,KamalaHarris,comment,lib,57
wow suprised suprised conservative however gop screwed big time gut call trump,KamalaHarris,comment,lib,28
think republican openly hate trump finally realizing useless try save republican party wanted truly rid world maga would create new third party siphon enough vote long enough time republican party dy second party insane people take place,KamalaHarris,comment,lib,42
see odds lot thing still want save country together correct way,KamalaHarris,comment,lib,16
another patriot cause cause democracy dont agree much agree need functioning democracy,KamalaHarris,comment,lib,15
liz cheney everyone know super duper conservative belief constitution belief day come support conservative candidate right trump threat democracy must stopped ballot box use vote help stop,KamalaHarris,comment,lib,15
big deal wish johnny isakson former senator georgia stood counted good record forever trumpenabler book balking impeachment called tarnished legacy,KamalaHarris,comment,lib,14
popular rightwing influencer break maga cult know isnt directly kamala ive seen conservative refreshing relieving anyway vote,KamalaHarris,post,lib,9652
really hope land slide want win really want republican get message going back there place real policy there place rest nonsense,KamalaHarris,comment,lib,1974
really appreciate referred orban autocrat opposed strongman latter irritates much stupid people interpret compliment,KamalaHarris,comment,lib,540
15 year ago told democrat would cheering reaganesque former prosecutor endorsed dick cheney id never believe im stoked,KamalaHarris,comment,lib,83
kamala look reaganesque 🤢 shes going get vote get vote guess edit get charisma like reagan well take vote get compare someone basically opposite spending social issue feel bit gross,KamalaHarris,comment,lib,211
start conservative christian trump came along couldnt believe quickly people sold belief support nay worship left party slowly began see thing clearly im liberal democrat atheist going back,KamalaHarris,comment,lib,40
there one thing agree strongly trump doesnt need lose need crushed gop need burn ground rebuilt ash hopefully moderate democrat split form counterpart progressive side party would ideal,KamalaHarris,comment,lib,34
canadian already battling version trump next election seems people want see reformed cleansed effective gop support democrat know need decent effective opposition keep worst instinct check id love see gop collapse clean maga cult member focus rebuilding democraticminded party eisenhower republican,KamalaHarris,comment,lib,47
let forget refused answer question want win ukraine russia stupid cat dog thing lot shit getting enough attention refusal answer make ally enemy,KamalaHarris,comment,lib,20
thank sharing ive waiting maga wake almost 10 year dont think movement appreciated guess,KamalaHarris,comment,lib,15
part message thought promising hey republican want party back vote harris show reject maga theyll lose ability control party way get back republican party 80 90 ideal claim support,KamalaHarris,comment,lib,14
im noticing lot die hard conservative extended family ultra conservative sitting election hate trump much lately time cant bring vote democrat wouldnt surprise republican party split way,KamalaHarris,comment,lib,12
he awful make look reaganesque thats basically said someone yesterday harris plan really arent crazy radical trump gone far right basic shit people want live one really supporting family value radical thing 25k first time home buyer really radical considering gave gi loan ww2 gi loan helped grandfather buy house grandparent raised 3 kid took care aging parent benefit homeownership gi loan still benefitting family day gi bill also helped unemployment education job training helped obtain education benefit 78 million veteran gi bill major contribution u stock human capital encouraged longterm economic growth good see need keep putting work get complacent frustrating literally trying tell year encouraging af finally see getting people harris awesome job debate clearly lay way,KamalaHarris,comment,lib,13
youre right youre right im skeptical harris win allow gop break maga similar tea party still fundamental element gop however chance healing trump lose,KamalaHarris,comment,lib,13
moment beginning week polling average appeared start narrowing remember thinking dare america forget miserable bastard man worked debate didnt actually worry return reality even betterseeming surprise entry race breath fresh air reinforcing obvious unfitness former president showcasing impressively skill opponent boot kamala tie james madison shortest president trump go smallest man ever hold office,KamalaHarris,comment,lib,10
step 1 elect kamala tim step 2 restore civility house step 2a ceasefire 2 state solution step 3 differ policy idea fixing dumb like citizen united step 4 prosper,KamalaHarris,comment,lib,20
pictured recycle bin full empty energy drink can every campaign hq,KamalaHarris,comment,lib,88
shes wholesome tricked msm past 35 year never follow msm ever ive looking past video truly working people ever since started career kamala harris people,KamalaHarris,comment,lib,162
whats kind wild see pride flag era democratic nominee didnt even support gay marriage back backbone advocate true marriage equality best could give legal status wasnt called marriage called civil union barack obama one people came around later sign take nothing granted granted one term taken away one term especially radicalizing court,KamalaHarris,comment,lib,23
could never predict back would get chance run shes talented ambitious lucky,KamalaHarris,comment,lib,17
already fairly major position da san francisco time say lot flew iowa help campaign,KamalaHarris,comment,lib,24
wow small world crazy think regular person u working 95 change trajectory life matter year truly inspiring dnc reflects american experience familiar,KamalaHarris,comment,lib,9
breaking news professor predicted every election correctly since 1984 predicts kamala winive following professor lichtman quite time formula even work retroactively predicted regan would win 1982 predicted obama would win second term also predicted hillary clinton would lose unfortunately even predicted biden would win 2020 formula thirteen key even worked history retroactively almost every election since 1860 predicts key 85 meaning kamala win remember dont take word solely go vote,KamalaHarris,post,lib,9622
check voter registration status state tx alone removed 1 million name roll,KamalaHarris,comment,lib,888
good sign let vote drove baby america fired trump 2020 2024 america reject good,KamalaHarris,comment,lib,215
2007 michigan overwhelming favorite beat appalachian state football vega didnt even bother creating spread game michigan lost realize extreme point respect opponent matter crazy appear work vote counted complacent volunteer vote drink water never give,KamalaHarris,comment,lib,865
predicted gore would win 2000 gore win aside supreme court shenanigan gore robbed thousand vote butterflyballot network correct called florida presidency gore,KamalaHarris,comment,lib,124
preaching choir know key alone wont look 2000 scotus interference easily change outcome vote need overwhelming red state need turn blue must avenue possible scotus interference encourage everyone vote,KamalaHarris,comment,lib,283
even 2016 wow must skill still everyone check registration volunteer help others register vote together team,KamalaHarris,comment,lib,108
win handily bottom line trump bad business one thing cult got right donold part establishment want desperately used done bad populist movement built coalition worst among u true antiestablishment movement would nice cant share tent bigot sex offender though,KamalaHarris,comment,lib,84
vote democratic ticket alllllll ballot old white boomer lady voting harriswalz,KamalaHarris,comment,lib,14
enough poll prediction compromised supreme court senate state electoral board election isnt vote total dont get complacent something think help,KamalaHarris,comment,lib,12
im celebrating im gon na get complacent dont want kamala harris win want landslide want see maga crumble want tear doesnt happen close win side yell rigged another decade vote,KamalaHarris,comment,lib,10
love patient nurturing kid im sure kid actually take use advice,KamalaHarris,comment,lib,708
precious hope young lady burn memory take advice heart sweet ❤️,KamalaHarris,comment,lib,78
youre standing speak remember kamala harris needed one sentence sum difference trump thats one person preparing speak constituent say trump every single thought action guided benefit nuff said vote harriswalz november,KamalaHarris,comment,lib,68
someone speak front large crowd regularly spot advice kamala isnt gaslighting proper way take control speaker,KamalaHarris,comment,lib,44
love interaction way looked directly made contact special moment girl really remember rest life,KamalaHarris,comment,lib,36
seeing lit girl face excitement give feel extremely excited kamala imagine ten time woman see mean girl america rolemodel pretty incredible,KamalaHarris,comment,lib,27
shes good person girl dont even look old enough vote endorse tangible way doesnt care candid moment moment,KamalaHarris,comment,lib,27
today la vega nevada rally harriswalz starting fill 🔥🔥🔥🔥 rally doesnt start another 15 hour yet,KamalaHarris,post,lib,8992
wow many people stadium hold edit thanks response im going round 20k look insane wish hello southern california,KamalaHarris,comment,lib,448
whoa look like going amazing event campaign seems really putting party democratic party,KamalaHarris,comment,lib,276
wish shed come texas always seems like right verge flipping blue need little nudge,KamalaHarris,comment,lib,171
chill ive never interest attending political rally id go one heartbeat,KamalaHarris,comment,lib,37
amazing documented fact butt seat questioned level verification suit always doubt cold hard fact every attendee need sit every doubter allay doubt similar parasitic relationship fire air air fire time cold hard fact aired live stream automatically feed denial fire headsup doubter prove doubt whats dinner lol,KamalaHarris,comment,lib,15
look diversity crowd like crowd kamalas rally thats america military protects sea white every trump rally,KamalaHarris,comment,lib,519
used hate entering army building seeing fucking picture chain command wall,KamalaHarris,comment,lib,60
isnt going go cemetery vet buried thousand ceremonial day problem ever one man go politics voting red platform diabolical would think brain heart soul,KamalaHarris,comment,lib,6
interviewer arent going able get prosecutor getting tripped interview going one core strength,KamalaHarris,comment,lib,741
people country obsessed rage bait shes cant wait see debate donold,KamalaHarris,comment,lib,152
witnessing political master class ive around 1992 bill clinton 60 kamala great time american voter,KamalaHarris,comment,lib,295
dont understand professional journalist brought like serious question like policy actually affect people life could talking cnn keep trying prove place new coke 24hour news channel,KamalaHarris,comment,lib,70
black people especially black woman used kind attack identity femininity white people response wasnt scripted many u think foolishnesslike go took long yeah type attack old dirt havent watched debate since obama doesnt chicken watching september 10 cable tv,KamalaHarris,comment,lib,44
