text,subreddit,post_or_comment,expected_political_leaning,score
agree thats medias fault clearly want trump reelected hence ignoring epstein list today,Liberal,comment,lib,12
press poodle trump lying dog bite man ie doesnt sell dick pill panty liner give good old democrat disarray intrigue palace theyre happy like goat garbage dump,Liberal,comment,lib,3
prosecuting trump medium ineffective president coherently parry prosecute trump narrative face something biden seemingly effective newfound goal medium therefore medium find person go trump believe eye poll general vibe likely voter need respectfully force change game plan immediately worst thing put responsibility beating trump medium instead opponent,Liberal,comment,lib,3
watched documentary bad faith christian nationalism hijacked republican party chose trump he gon na scapegoat go badly theyre ingrained government dollar go watch,Liberal,comment,lib,6
dems political party r cult mainstream medium company put earning money everything trump presidency equal rating equal money,Liberal,comment,lib,6
lol thought funny debate way trump kept looking audience smiling making eye contact nodding people audience wish wed gotten camera angle,Liberal,comment,lib,2
agree havent seen one headline trump embarassing 100 dishonest performance oh joe old he got ta go,Liberal,comment,lib,2
newsworthy dem voter party member office trying push unfortunately trump trump isnt big news thing dy,Liberal,comment,lib,2
never forget trump said hed go away lost 2020 he saying hell go away loses election believe hell definitely try cant every 4 year dy fucking insane vote like hell there way deny time trump itll one kid next loses big entire dynasty loses big,Liberal,post,lib,630
attempt boost maga turnout see threat belief probably correctly many republican saddened idea life without dear leader fight privilege continuing bask dim orange glow although time loses may forced go away involuntarily result legal problem alternatively may flee russia,Liberal,comment,lib,13
sooooooo tired donald spread chaos fear want slow news day want boring politics want live life without existential angst orange turd want dictator go russia,Liberal,comment,lib,9
im sure trump know would loses since case moved heaven earth delay catch flee country go mothership russia,Liberal,comment,lib,8
yes bullshitometer going crazy announcement hell literally anything keep name news mean distracting kamalas accomplishment hell instruct rupert murdoch fascist minion infecting congress blow meaningful legislation prevent democrat getting win like border bill maga fox news legitimate threat american democracy long trump gone,Liberal,comment,lib,3
heck would even believe one thing say dont care happens would love see end mess created,Liberal,comment,lib,2
let ask name one good thing kamala harris done country last 3 half year shes office,Liberal,comment,lib,0
huge thing come debate didnt say manipulated goaded like hilary didnt cite evidence right front god everyone live demonstration pushed button watched happened,Liberal,comment,lib,50
roger stone said float idea rewords word tell great idea go full force yeah,Liberal,comment,lib,3
one strongest point made debate imo bad cult doesnt believe theyd prefer believe hed stop war became president debate concept plan healthcare cause he president super logical,Liberal,comment,lib,1
actually terrible job countering think way could say something since still destroyed frustrated point didnt make still whooped,Liberal,comment,lib,1
gee maybe something want see elected something look like elected bad,Liberal,comment,lib,1
true although trump certain wild card still make unpredictable enough foreign affair demand respect foreign leader harris isnt better anything necessary advance career shes done whole career hence shell happily puppet whoever actually running country obama,Liberal,comment,lib,-15
4 gop governor refute trump hurricane storyconvicted felon trump tell truth mouth shut,Liberal,post,lib,587
pardon french absolutely fucking sickening theyre lengthy list republican rejected additional funding fema couple week ago immigrant relief program entirely different disaster relief fund conspiratorial lie way sexier truth countless swing voter probably never consider educating,Liberal,comment,lib,35
hope maga minion realize actually voting shady vance president dizzy donnie trump going make next 4 years…🤪,Liberal,comment,lib,19
mean every time trumplethinskin open mouth something dumb untrue come color shocked,Liberal,comment,lib,11
surprised gogo boot desantis isnt list act like petulant child regarding anything might look good democrat,Liberal,comment,lib,9
doesnt matter im 90 sure one dont believe govs dissociative identity disorder described dsm5 30015 disagreeing identity donald activates group identity response worse donald get worse theyll get jesus could come back tell donald lying theyd call msnbc watching baby killer tell saw x facebook ask hate america gon na believe… people ive never met social medium fox elon musk donald… people ive never met social medium every nonfox news channel politician elected,Liberal,comment,lib,2
hurricane helene revealed lot donald trump american needed support spread lie put spotlight instead revealed come took long figure thats trump operates really really paying closer attention,Liberal,comment,lib,2
doesnt matter god thing existed doesnt instance could come high kick magat dipstick collective crotch lay fact like school teacher theyd still believe trump bullshit fact truth something seriously wrong people,Liberal,comment,lib,1
know theyd dispute yeah study liberal university convinced higher academia tends lean left indoctrination rather real causation fact people gain knowledge broaden exposure world tend outgrow conservative ideal personally felt went college wasnt even becoming liberal simply questioning former conservative viewpoint,Liberal,comment,lib,123
friendly reminder statistic apply group individual republican party specifically engineered situation accidental direct result using hatred false boogymen lie get voter vote interest,Liberal,comment,lib,47
remember nursing instructor discussing objective way less discussing different group people interpret utilize information differently,Liberal,comment,lib,15
lately reading republican brain science deny science — reality chris mooney highly recommend,Liberal,comment,lib,14
study alarming worried threat right wing authoritarianism indicates right much less able reconcile veracity ideological belief v new information presented new information contradicts ideological inverse left much better able evaluate new information even contradicts belief various study come similar conclusion show similar cognitive difference liberal conservatives… human society overall thus anchored right wing ideology scary part mean drunken walk history society stumble right left footing stumble right clearly navigable path forward guardrail keep happening,Liberal,comment,lib,7
many conservative know always say hate read cant stand reading havent read anything since high school etc frikken embarrassing,Liberal,comment,lib,2
think bit actually unsurprising inability pull away one belief make conservative wanting thing stay,Liberal,comment,lib,3
people see magaism revamped nazismim curious cuz feel like people support trump would consider hitler bad guy know proud boy dont working class people buy immigrant shtick guy remember south park episode tuk ur jerbs mean actually lot people felt trump said criticized saying people wonder billionaire steal poor give rich would supported proletariat validates anger thats connection cant break thats trump popular working class thats hitler dialed well blaming failing economy outside ethnic group saying racist crap poorlyeducated working class majority whispering behind closed door never gon na pull working class least uneducated one mean speak rest educated world people dont want life pulled root trump dictatorship mean let stop playing trump isnt fat idiot lie lot trump potentially next mein fuhrer dont want live world thats case dont want fruit ai go one individual china seize taiwan rest democratic world crumble mighty tyrannical triumvirate recognize fucking threat something living 1933 germany hitler elected chancellor didnt even win popular vote used voter intimidation nobody stopped im sick educated people acting like candidate good bad open fucking eye late,Liberal,post,lib,577
think youre making mistake thinking magats arent fully aware theyve signed onto supporting trump long past point plausible deniability plausible ignorance pertains knowing final stop trump train anyone still along ride choice big threat democracy fat orange fuck worship arent conned theyre con,Liberal,comment,lib,100
may come surprise america full racist hateful stupid enough people sympathetic fascism,Liberal,comment,lib,15
greatest gift enemy human being ignorance coupled unfocused anger person preying saying sure youre smart youd rich thats hurt worst seeing many people preyed offer throat cutting first want kill scapegoat,Liberal,comment,lib,7
polarization one biggest factor propaganda right become effective widespread everything apocalyptic game u versus maga true believer absolutely believe 100 day democrat march soldier street start rounding everyone disagrees throw concentration camp thats future think side mere minute away enacting given moment wouldnt support dictator especially dictator say hell safeguard thing important point care giving right losing democratic system better democrat mind basically know nazism think better decade propaganda told democrat want,Liberal,comment,lib,8
plenty people see vote november going door door register people vote getting dangerous nazi violent fuck,Liberal,comment,lib,10
problem society move forward look back time see eventually progress always win younger generation learn good older gen come recognize bad tend reject thus time society shift change meanwhile people hold older idea either dogmatic reason inability adapt add older generation cant pick error way time people tend build backside society moving forward begin feel oppressed ironically cant oppress people longer feel though losing control society whether dogma cultural ignorance fear change destroying everything get angry pissed start rejecting institution support advance science medicine become increasingly isolated reality building bubble belief become increasingly mad world grifter come along particularly narcissistic one desperate adoration going say whatever crowd want hear politician practice nuance desperate piss anyone might vote couch comment safe speech practice saying lot word mean nothing reality talk complex idea require deep understanding issue maga base know pissed hearing nuance sort piss feel like world yanked nuance thug like trump speaks come glib charismatic quickly learns word get adoration craves become welded like plate submarine depth add mix decade gop conservative deliberately trying undermine science expert funding think tank thing fox news well following play book established one nixon acolyte mean disconnecting people reality recipe disaster,Liberal,comment,lib,9
poisoning blood america 4th reich get trump even promised mass deportation concentration camp voting mother fucker insane,Liberal,comment,lib,2
people support trump would consider hitler bad guy would consider bad guy 2024 hindsight 1930s many would absolutely supported hitler hitler didnt start concentration camp killing jew started hateful rhetoric scary similarity trump said ever wonder would done ordinary german citizen 1930s germany hitler rising power concentration camp killing youre pretty much,Liberal,comment,lib,4
try getting across republican voting parent start crooked joe… two side coin time try brainwashing strong,Liberal,comment,lib,3
nazis=killed jew concentration camp maga=has killed jew concentration camp thats understand nazi,Liberal,comment,lib,4
load people today hold belief hitler right ideas— aside holocaust took bit far wasnt idea outright deny ever happened wooden door stuff people need remember u 30000 nazi msg nyc… load american wanted stay wwii extent conspiracy theory involving entrance war,Liberal,comment,lib,2
talk evangelicals much think nazi term human experimentation police state persecution jew dont think get nazi came power blaming economic social change country people germany illegally dont think get germany able build war machine enslaving people eastern european country dietrich bonhoeffer guy talked lot 90 evangelical bible college bonhoeffer society started encouraging christian reject trump magaism 2017 two week trump first inauguration eligible voter u dont pay enough attention politics heard something like,Liberal,comment,lib,4
average maga voter nazi nazi word specific meaning thats bad deluded person bad person without nazi dont keep using worst word think describe everything thats bad,Liberal,comment,lib,-1
nazi germany defeated next generation appalled previous one hadnt stood complicit people like think would able fight back hitler lived back time machine etc might actually going road maybe look way resisting also hitler never 1933 election lost handily moderate hindenburg appointed hitler chancellor hoping gain support nazi died 1934 leaving hitler key power voting nothing back prevent,Liberal,comment,lib,1
mean rational people racist hate filled political nationalist driven rally outside election year,Liberal,comment,lib,1
21 year age black male blue collar worker voting joe biden like supreme court fact damage made republican getting power voted year ago 18 continue cause republican actual policy help middle class outside blame game top even try compromise democrat help fight inflation help struggling middle class voter seems like gop focused maintaining power cost thats enough reason vote opposite,Liberal,post,lib,560
dont care reddit considered echo chamber republican havent shown interest actually caring middle class play blame game take information gladly explain full reasoning cause tip iceberg,Liberal,comment,lib,52
agree everything said im 21 year old guy physical disability use power wheelchair ill voting biden administration ensure cant discriminated insurance company disability thanks aca trump want repeal,Liberal,comment,lib,21
vote president isnt one person entire branch government includes ten thousand appointed position well future entire judicial branch people think vote president doesnt matter woefully uninformed,Liberal,comment,lib,6
thats fine like joe make even easier brings compassion wherever go,Liberal,comment,lib,4
everyone going vote joe biden dont think trump added support debate dont think biden lost voter finally yall learning vote best path b,Liberal,comment,lib,4
argument respect sick gaslit biden wonderful president voting side full stop,Liberal,comment,lib,8
white blue collar male voting biden administration push back project 2025 cabnet yes men tangerine mussolini push even faster,Liberal,comment,lib,2
bar set low anyone isnt going actively dismantle country benefit would preferable please thank,Liberal,comment,lib,3
voting trump upcoming election treasonlet make abundantly clear 2021 became apparent trump lost election insighted insurrection attempt follower overthrow government give another term attempting overthrow government treason rioter survived terrible day tried treason justice world convicted everything done country trump fucking audacity run president would want back man attempted overthrow government became quite apparent lost vote committing treason helping someone attempted overthrow government put back position could get reelected every single person voted guilty treason justice world would tried convicted dont care authoritarian sound truth matter really love america much claim vote trump really want bastard back office fun committing treason,Liberal,post,lib,562
live united state know treason defined differently rest world specifically treason act levying war united state adhering enemy giving aid comfort second bit also get specific form requires providing arm declared enemy state providing assistance state excludes treating injury enemy providing food rioter dont believe single one tried treason sedition sure definitely treason,Liberal,comment,lib,77
intended audience post trying convince people tone take someone try get side vast majority case basic research make people change mind navigate conversation messaging give desire right focus make connection intended audience fact might benefit hearing stake half high say severe obligation learn message effectively need ten time humility charitability currently using trump voter average decent human being living world extremely imperfect information political polarization blind spot wrong side history way would benefit keep mind virtually one country education free time exposure meaningful opposing viewpoint journalistic literacy historical knowledge cast meaningfully informed vote never attribute malice attributed ignorance remember stupid average american half stupider applies dems countless legitimate reason wish vote dems biden,Liberal,comment,lib,41
eh party us first amendment right put candidate whatever dog pony show primary process follow procedure allowed court function put candidate ballot citizen us constitutional right vote rightly wrongly treason dislike candidate dislike candidate action heck dislike voter choice doesnt make treason allowed happen due court law process weve allowed country put place based vote active country democratic process youre adding vitriol fire u v battle keep progress happening government,Liberal,comment,lib,12
might exposing much medium especially much medium one opinion see medium today simply opinion rich person rich person buy medium outlet use express opinion advantageous would someone buy newspaper wont make money whats investment ability train populous follow belief effort reach outcome desire…public political policy politics become like religion based faith fact news outlet religious doctrine news fox msnbc cnn specifically called entertainment news opinion propaganda make sad know people believe gospel lack intelligence form world view,Liberal,comment,lib,6
nation founded constitution includes bill right still set america great nation apart world im saying america perfect im stating person run office desire put america first,Liberal,comment,lib,4
thats need vote enlighten others vote democracy know colorado judge say trump invoved insurrection said still run doesnt apply former president clear pool full mud clear committed insurrection there petition remove ballot state ill sign ten time,Liberal,comment,lib,2
tried charged seditious conspiracy jury peer trump indicted election interference 4 central effort outlined indictment regarding trump ally effort overturn voter undermine result 2020 georgia presidential election include effort get georgia official invalidate nullify georgia voter including finding vote exist scheme get 16 fake elector georgia cast fraudulent electoral college vote trump even though trump win popular vote state intimidating harassing threatening georgia election worker based false accusation effort influence testimony witness tampering county voting machine 19 defendant including trump charged criminal racketeering georgia racketeer influenced corrupt organization rico act tie together individual criminal act broader criminal network conspiracy fulton county georgia indictment brought grand jury everyday citizen convened da fani willis da willis highly respected veteran prosecutor investigating trump ally effort meddle 2020 election twoandahalf year grand jury heard many witness including state official asked trump ally help overturn result 2020 presidential election,Liberal,comment,lib,5
risk pushing people violence thats youre going approach remember abandon trump treason youre enemy better win,Liberal,comment,lib,5
would vote anybody trump without even looking theor policy perfect exactly need,Liberal,comment,lib,5
owner major social medium platform—and u government contractor—is opining assassination political opponent alarming american across political spectrum lewis say warns culture war narrative thinly veiled racism already effect real world could exacerbated farrights willingness answer call arm extremist waiting justification engage violence say rhetoric like provides perfect excuse,Liberal,comment,lib,46
true naturalised citizen could found part associating group whose aim destroy openly oppose u government lose u citizenship deported deported lose right enter u citizenship restored,Liberal,comment,lib,6
elon musk awesome 😎💯 liberal cant stand speaks truth way pronoun cartree,Liberal,comment,lib,0
stance get voiced large platforms… well… good thing shout adam schiff loudly often encourage stand likewise,Liberal,comment,lib,8
sound like good start expanding size house 3x5x would also increase respect democracy citizen expect democracy government,Liberal,comment,lib,7
good ec problem need stop filibuster general also expand supreme court removing corrupt piece conservative shit,Liberal,comment,lib,5
bout time pantently unfair un democratic inbred yokel wyoming vote count 60 someone ca minority rule country killing u,Liberal,comment,lib,5
yeah seems like might good idea regard electoral college since institution seems work handinhand gerrymandering,Liberal,comment,lib,3
republican would never million year give clearly unfair advantage ec give would never another republican president without advantage,Liberal,comment,lib,3
never understood state electoral vote werent divided apportionately instance let say michigan 10 electoral vote biden win 70 vote trump win 30 vote biden would get 7 electoral vote trump would get 3 im probably missing something would 2nd best way deal ec best way deal ec would abolish,Liberal,comment,lib,3
visionary california wealth talented democratic politician eg schiff porter newsom swallwell moment delivering across board deeply grateful competent leadership counterpoint failure current republican party california senate candidate congressmember adam schiff calling major overhaul american institution including getting rid electoral college expanding supreme court eliminating filibuster sweeping policy rollout obtained exclusively politico reinforces schiffs central pitch senate campaign defender democracy drawing highprofile role first impeachment thenpresident donald trump congressional investigation jan 6 attack capitol though many individual agenda item new proposal schiff together present fullest accounting vision bolster america democracy wake normsshattering influence trump package also lay marker los angelesarea representative driving message race replace late sen dianne feinstein nears competitive march 5 primary,Liberal,comment,lib,2
dont want mean undecided voter brain damageim listening north carolina undecided voter interviewed debate honestly think lost braincells listening,Liberal,post,lib,527
put perspective think airplane flight attendant come aisle food cart eventually park beside seat interest chicken asks would prefer platter shit bit broken glass undecided election pause moment ask chicken cooked david sedaris,Liberal,comment,lib,211
salad shit sandwich 🤔 sandwich bread like bread there shit deal salad seems fine date dont know anything date seem bit scary ill take shit sandwich,Liberal,comment,lib,47
people unsure harris go check youtube there clip senate committee hearing take jeff session also brett kavenough confirmation hearing watched hearing live airing one better grilling,Liberal,comment,lib,65
must believe someone claim undecided say get unwarranted attention there zero chance point american able discern two candidate maybe person coma since 2015 woke yesterday uncertainty could taken seriously theyre genuine otherwise taken seriously,Liberal,comment,lib,43
people normalizing trump bullshit he another candidate im still 2016 shock electing idiot president united state ill spare long description awful pice shit actually know get guy subhuman narcissistsociopath literally enough people defeat stinky as need get pole election day hope another thousand year anyone ilk emerges still baffle guy get ten vote much less 74 million american people disappointment life thought smarter,Liberal,comment,lib,18
yes stupid crap republican done since bush jr would think wouldnt undecided voter consider republican party since reagan technically gop shouldnt even exist point undecided voter conservative blindly vote r name completed corrupted concept democracy supposed deserve live country deserve reap benefit blood shed multiple century country become,Liberal,comment,lib,8
love taylor tomlinson said like im hungry dont know eat sandwich chew broken glass,Liberal,comment,lib,11
curious percentage even vote take time cast ballot serious doubt brain show,Liberal,comment,lib,8
legitimately believe undecided voter point think anyone claiming undecided hiding voting vote supposed anonymous,Liberal,comment,lib,12
many voting republican dont want admit many dont think politics likely vote based name order height name sound look paper etc know example 2016 one reason trump blue wall state name came first ballot 2000 bush name came first florida al goores name first would florida wide enough margin wouldnt needed recount journalist investigated actually win florida yeah thats decides election policy economy name order masculinity name,Liberal,comment,lib,4
either somehow avoid news social medium conversation politics friend family coworkers—something incredibly hard fathom suppose could happen youre like hermit live grid,Liberal,comment,lib,2
recently explain someone know kamala fact running president person heard something someone named camela stopped running president,Liberal,comment,lib,2
